{
  "schemaVersion": "1.0.0",
  "id": "season:2025",
  "name": "2025 Crop Year",
  "dateRange": {
    "start": "2025-01-01",
    "end": "2025-12-31"
  },
  "jobIds": [
    "job:2025-plant-soy",
    "job:2025-spray-1",
    "job:2025-harvest-corn"
  ],
  "notes": "Planning shell that aggregates planting, spraying, and harvest operations across farms.",
  "optimizerState": {
    "planner": "profit/v1",
    "stateHash": "sha256:9ad8fd1c",
    "targets": {
      "marginPct": 18.0,
      "inputBudgetUsd": 52000
    }
  },
  "createdBy": "user:planner.annika",
  "createdAt": "2025-01-02T14:00:00Z",
  "lastModifiedAt": "2025-03-15T22:45:10Z",
  "extensions": {
    "analytics.crop": {
      "rotation": "corn-soy-corn",
      "anticipatedAreaHa": 128.4
    },
    "reporting.checklist": {
      "preseasonBriefed": true
    }
  }
}
